{
  "artifact_type":"workstream_checkpoint",
  "schema_version":"1.0.0",
  "checkpoint_id":"HP-CP-PLAN-010-001",
  "artifact_digest":"sha256:7777777777777777777777777777777777777777777777777777777777777777",
  "project_id":"hive-plan",
  "repository":"KayzenRoot/hive-plan",
  "workstream_id":"planning/hp-plan-010",
  "workstream_kind":"PLANNING",
  "source_branch":"docs/hp-plan-010-engineering-chat-project-brain",
  "source_commit_sha":"daedec3cc251e7abfd074eab31812ebafe9d814e",
  "project_phase":"PLANNING",
  "current_objective":"Complete HP-PLAN-010 freeze validation without mutating HP-WO-0001.",
  "active_issue_ids":[23],
  "active_work_order_ids":[],
  "active_pr_ids":[],
  "canonical_sources":[{"source_id":"docs/89-engineering-chat-project-brain.md","source_type":"architecture","authority":"CANONICAL","repository":"KayzenRoot/hive-plan","path":"docs/89-engineering-chat-project-brain.md","git_sha":"daedec3cc251e7abfd074eab31812ebafe9d814e","fingerprint":"sha256:aaaaaaaaaaaaaaaaaaaaaaaaaaaaaaaaaaaaaaaaaaaaaaaaaaaaaaaaaaaaaaaa","critical":true}],
  "frozen_decisions":[],
  "unresolved_decisions":["Final freeze requires mechanical validation and reconciliation."],
  "completed_since_previous":["Visual Bible, checkpoint contracts and implementation blueprint governance designed."],
  "remaining_scope":["Run schema/semantic validation and create immutable final planning checkpoint."],
  "blockers":[],
  "known_risks":["Parallel HP-WO-0001 must remain isolated until reconciliation."],
  "failure_patterns_relevant":["numeric-doc-prefix-collision"],
  "next_recommended_action":"Validate all new schemas and fixtures, then reconcile against current main and HP-WO-0001.",
  "stop_condition":"Do not freeze or merge until F1-F9 pass.",
  "context_lock_state":"NOT_APPLICABLE",
  "last_verified_github_watermark":"main@88916137b4d07c8736320f052670a95df740c100",
  "resume_policy":"SAFE_CONTINUE",
  "supersedes_checkpoint_id":null,
  "created_at":"2026-09-11T19:16:00Z",
  "producer":{"kind":"hive-plan-agent","name":"Checkpoint Continuity Agent","version":"proposal-v1"}
}