{
  "artifact_type":"workstream_checkpoint",
  "schema_version":"1.0.0",
  "checkpoint_id":"HP-CP-WO-0001-OBS-001",
  "project_id":"hive-plan",
  "repository":"KayzenRoot/hive-plan",
  "workstream_id":"implementation/hp-wo-0001",
  "workstream_kind":"IMPLEMENTATION",
  "source_branch":"feat/hp-wo-0001-cockpit-foundation",
  "source_commit_sha":"88916137b4d07c8736320f052670a95df740c100",
  "project_phase":"IMPLEMENTATION",
  "current_objective":"Execute authorized HP-WO-0001 First Cockpit Vertical Slice against its fresh Context Lock and exact evidence obligations.",
  "active_issue_ids":[21],
  "active_work_order_ids":["HP-WO-0001"],
  "active_pr_ids":[],
  "canonical_sources":[
    {"source_id":"work-orders/HP-WO-0001/context-lock.json","source_type":"contract","authority":"CANONICAL","repository":"KayzenRoot/hive-plan","path":"work-orders/HP-WO-0001/context-lock.json","git_sha":"88916137b4d07c8736320f052670a95df740c100","fingerprint":"sha256:5d57dcf9cdab74d8ce203b76fd0a81e4bc9a62339a865894bd07d0a140f7f376","critical":true},
    {"source_id":"work-orders/HP-WO-0001/work-order.json","source_type":"work_order","authority":"CANONICAL","repository":"KayzenRoot/hive-plan","path":"work-orders/HP-WO-0001/work-order.json","git_sha":"88916137b4d07c8736320f052670a95df740c100","fingerprint":"sha256:f1a7a05cecf676ac5f83d9b44e42d675ee8e52497e8ba10c0787d5adcbfd8efd","critical":true},
    {"source_id":"work-orders/HP-WO-0001/compileguard-report.md","source_type":"evidence","authority":"VERIFIED_FACT","repository":"KayzenRoot/hive-plan","path":"work-orders/HP-WO-0001/compileguard-report.md","git_sha":"88916137b4d07c8736320f052670a95df740c100","fingerprint":"sha256:cef2b0a6119c23104faeca5c93738d5b635c7b50911dd03ae16d2351831ea5ef","critical":true},
    {"source_id":"work-orders/HP-WO-0001/executor-package.md","source_type":"work_order","authority":"CANONICAL","repository":"KayzenRoot/hive-plan","path":"work-orders/HP-WO-0001/executor-package.md","git_sha":"88916137b4d07c8736320f052670a95df740c100","fingerprint":"sha256:4e05799dc17437784e0568e0cdc856a1fee8dca006bb66ac2d5b39c42d53499e","critical":true}
  ],
  "frozen_decisions":["HP-WO-0001 authorization at 88916137b4d07c8736320f052670a95df740c100"],
  "unresolved_decisions":[],
  "completed_since_previous":["Authorization package merged to main; implementation branch observed identical to main with zero implementation commits."],
  "remaining_scope":["Execute the canonical Work Order on feat/hp-wo-0001-cockpit-foundation.","Produce exact-head tests/evidence, review and audit before merge."],
  "blockers":[],
  "known_risks":["Any critical planning-source promotion to main can stale the active Context Lock and requires deliberate revalidation/recompile."],
  "failure_patterns_relevant":["stale-context-lock","executor-claim-as-evidence","silent-scope-expansion"],
  "next_recommended_action":"Execute HP-WO-0001 from the canonical work-order/context-lock package without allowing HP-PLAN-010 planning changes to mutate this implementation branch.",
  "stop_condition":"Stop only when all applicable HP-WO-0001 acceptance/evidence obligations pass at exact head or a truthful blocker requires escalation.",
  "context_lock_state":"FRESH",
  "last_verified_github_watermark":"main@88916137b4d07c8736320f052670a95df740c100|feat/hp-wo-0001-cockpit-foundation@88916137b4d07c8736320f052670a95df740c100|IDENTICAL",
  "resume_policy":"SAFE_CONTINUE",
  "supersedes_checkpoint_id":null,
  "created_at":"2026-09-11T19:16:00Z",
  "producer":{"kind":"tool","name":"GitHub reconciliation observation","version":"hp-plan-010-freeze"},
  "artifact_digest":"sha256:039ed91dac2288d9548bce9e2087804d8c961202c176a37e1c6bec7cc0649ce0"
}